{
  "id": "chip",
  "name": "Chip",
  "dsId": "jedi",
  "summary": "Compact label, status indicator, or filter affordance. Typography spec: Inter 500, 12/16, 0.16px. Status chips use the 160p/190p tint recipe — background `shades-190-p`, content `shades-160-p`. Decorative category chips use `primary` / `secondary` palettes; status meaning belongs to `error`/`warning`/`info`/`success`.",
  "anatomy": [
    { "part": "container", "description": "Rounded surface with `shades-190-p` background (status) or `primary.shades-12-p` (selected filter)." },
    { "part": "leading-icon", "description": "Optional MUI icon at 16/20px in the same color as the label." },
    { "part": "label", "description": "Chip typography (Inter 500, 12/16, 0.16px).", "required": true },
    { "part": "delete-icon", "description": "Optional dismissable affordance; click target ≥ 24×24 inside chip." }
  ],
  "props": [
    { "name": "label", "type": "string", "required": true },
    { "name": "variant", "type": "'filled' | 'outlined'", "default": "outlined" },
    { "name": "color", "type": "'default' | 'primary' | 'secondary' | 'error' | 'warning' | 'info' | 'success'", "default": "default" },
    { "name": "size", "type": "'small' | 'medium'", "default": "medium" },
    { "name": "icon", "type": "ReactElement" },
    { "name": "onDelete", "type": "() => void", "description": "Renders the delete icon when provided." },
    { "name": "onClick", "type": "() => void", "description": "Makes the chip act as a button/toggle." },
    { "name": "disabled", "type": "boolean", "default": false }
  ],
  "variants": [
    { "axis": "variant", "values": ["filled", "outlined"], "default": "outlined" },
    { "axis": "color", "values": ["default", "primary", "secondary", "error", "warning", "info", "success"], "default": "default" },
    { "axis": "size", "values": ["small", "medium"], "default": "medium" }
  ],
  "states": [
    { "name": "rest" },
    { "name": "hover", "description": "State-layer overlay on the chip surface." },
    { "name": "focus-visible", "description": "Visible focus ring." },
    { "name": "selected", "description": "Filled `primary.shades-12-p` background, `primary.main` text — only when used as a filter toggle." },
    { "name": "disabled", "description": "`action.disabled` text + `action.disabled-background`." }
  ],
  "a11y": [
    "If the chip is interactive (filter/toggle), it must be reachable by Tab and operable via Enter/Space; otherwise it's a non-interactive label.",
    "Status chips must include text — never indicate state via color alone.",
    "The delete icon needs an accessible name (e.g., `aria-label=\"Remove\"`)."
  ],
  "examples": [
    {
      "label": "Status chip (success)",
      "language": "tsx",
      "snippet": "import { Chip } from '@mui/material';\n\n<Chip label=\"Active\" color=\"success\" variant=\"filled\" size=\"small\" />"
    },
    {
      "label": "Filter chip (toggle)",
      "language": "tsx",
      "snippet": "<Chip label=\"All cohorts\" color={active ? 'primary' : 'default'} onClick={toggle} />"
    },
    {
      "label": "Removable",
      "language": "tsx",
      "snippet": "<Chip label=\"Beta\" onDelete={remove} />"
    }
  ],
  "doNot": [
    "Use a chip as the principal action of a view — that's a Button's job.",
    "Render a status chip in `secondary` (orange) to mean caution — caution belongs to `warning` via tint recipe.",
    "Skip the label and rely on a color-only chip.",
    "Stack >7 filter chips visible at once — group, hide behind a 'more' menu, or move to a multiselect."
  ],
  "tokensUsed": ["primary.shades-12-p", "primary.main", "success.shades-190-p", "success.shades-160-p", "error.shades-190-p", "error.shades-160-p", "action.disabled", "action.disabled-background"]
}
