{
  "id": "text-field",
  "name": "TextField",
  "dsId": "jedi",
  "summary": "MUI TextField in the Jedi system. Always paired with a real `<label>` (MUI does this for you when you pass `label`). Validation runs on blur; error state pairs `error.main` with a helper message (never color alone).",
  "anatomy": [
    { "part": "label", "description": "Inter 400, 12/12, 0.15px; always present.", "required": true },
    { "part": "input", "description": "Inter 400, 16/24, 0.15px; value in `text.primary`, placeholder in `text.secondary`." },
    { "part": "outline", "description": "1px border in `other.outlined-border-23-p` (outlined variant); thicker `primary.main` on focus." },
    { "part": "adornment", "description": "Optional `InputAdornment` start/end (icon button or text)." },
    { "part": "helper-text", "description": "Inter 400, 12/16, 0.4px; switches to `error.dark` when invalid." }
  ],
  "props": [
    { "name": "variant", "type": "'outlined' | 'filled' | 'standard'", "default": "outlined" },
    { "name": "label", "type": "string", "required": true },
    { "name": "value", "type": "string", "required": true },
    { "name": "onChange", "type": "(e: ChangeEvent<HTMLInputElement>) => void", "required": true },
    { "name": "helperText", "type": "ReactNode" },
    { "name": "error", "type": "boolean", "default": false },
    { "name": "disabled", "type": "boolean", "default": false },
    { "name": "size", "type": "'small' | 'medium'", "default": "medium" },
    { "name": "InputProps", "type": "Partial<InputProps>", "description": "For start/end adornments." }
  ],
  "variants": [
    { "axis": "variant", "values": ["outlined", "filled", "standard"], "default": "outlined" },
    { "axis": "size", "values": ["small", "medium"], "default": "medium" }
  ],
  "states": [
    { "name": "rest", "description": "Outline `other.outlined-border-23-p`; label `text.secondary`." },
    { "name": "hover", "description": "Outline `text.primary` at hover opacity." },
    { "name": "focus", "description": "Outline `primary.main` 2px; floating label `primary.main`." },
    { "name": "filled", "description": "Value in `text.primary`." },
    { "name": "error", "description": "Outline + helper in `error.dark` (light) / `error.light` (dark); inline icon required." },
    { "name": "disabled", "description": "Color & outline use `action.disabled`; never custom opacity." }
  ],
  "a11y": [
    "Every input has an associated label — pass `label`, do not rely on placeholder.",
    "Error state pairs color with a written error message; never use color alone.",
    "Validate on blur, never per keystroke.",
    "Failed form submissions preserve every field value (loss aversion)."
  ],
  "examples": [
    {
      "label": "Outlined with helper",
      "language": "tsx",
      "snippet": "import { TextField } from '@gl/jedi';\n\n<TextField\n  label=\"Email\"\n  value={email}\n  onChange={(e) => setEmail(e.target.value)}\n  helperText=\"Use your work address.\"\n/>"
    },
    {
      "label": "Error with inline icon",
      "language": "tsx",
      "snippet": "import { TextField, InputAdornment } from '@mui/material';\nimport ErrorOutline from '@mui/icons-material/ErrorOutline';\n\n<TextField\n  label=\"Email\"\n  value={email}\n  onChange={onChange}\n  error={!!err}\n  helperText={err}\n  InputProps={{ endAdornment: err ? <InputAdornment position=\"end\"><ErrorOutline color=\"error\" /></InputAdornment> : undefined }}\n/>"
    }
  ],
  "doNot": [
    "Drop the label and rely on a placeholder.",
    "Use `error.main` for the helper text (3.6:1 fails AA) — use `error.dark` or the 160p/190p tint recipe.",
    "Wipe entered values on a failed submit.",
    "Disable a field via `opacity: 0.5` or a custom grey."
  ],
  "tokensUsed": ["primary.main", "text.primary", "text.secondary", "other.outlined-border-23-p", "error.dark", "error.shades-160-p", "error.shades-190-p", "action.disabled"]
}
